{
  "coverage": [
    {
      "block": "A.domain",
      "canon_role": "R4",
      "fold_status": "PENDING_ADR",
      "r3_section": "reference",
      "status": "PRESENT",
      "warnings": []
    },
    {
      "block": "B.selection",
      "canon_role": "R6",
      "fold_status": "PENDING_ADR",
      "r3_section": "guide-achat",
      "status": "PRESENT",
      "warnings": [
        "selection.checklist < 3 (0)"
      ]
    },
    {
      "block": "C.diagnostic",
      "canon_role": "R5",
      "fold_status": "LIVE",
      "r3_section": "diagnostic-rapide",
      "status": "PRESENT",
      "warnings": []
    },
    {
      "block": "D.maintenance",
      "canon_role": "R3",
      "fold_status": "NATIVE",
      "r3_section": "maintenance",
      "status": "PRESENT",
      "warnings": []
    },
    {
      "block": "E.installation",
      "canon_role": "R3",
      "fold_status": "NATIVE",
      "r3_section": "installation",
      "status": "PRESENT",
      "warnings": []
    },
    {
      "block": "5.0:variants",
      "canon_role": "—",
      "fold_status": "NOT_FOLDED",
      "r3_section": null,
      "status": "NOT_MAPPED",
      "warnings": []
    },
    {
      "block": "5.0:location_on_vehicle",
      "canon_role": "—",
      "fold_status": "NOT_FOLDED",
      "r3_section": null,
      "status": "NOT_MAPPED",
      "warnings": []
    },
    {
      "block": "5.0:key_visual_features",
      "canon_role": "—",
      "fold_status": "NOT_FOLDED",
      "r3_section": null,
      "status": "NOT_MAPPED",
      "warnings": []
    },
    {
      "block": "5.0:purchase_guardrails",
      "canon_role": "—",
      "fold_status": "NOT_FOLDED",
      "r3_section": null,
      "status": "NOT_MAPPED",
      "warnings": []
    },
    {
      "block": "5.0:conseil_v5",
      "canon_role": "—",
      "fold_status": "NOT_FOLDED",
      "r3_section": null,
      "status": "NOT_MAPPED",
      "warnings": []
    },
    {
      "block": "5.0:diagnostic.depose_steps",
      "canon_role": "—",
      "fold_status": "NOT_FOLDED",
      "r3_section": null,
      "status": "NOT_MAPPED",
      "warnings": []
    },
    {
      "block": "compatibility",
      "canon_role": "R1/R2",
      "fold_status": "NOT_FOLDED",
      "r3_section": null,
      "status": "BLOCKED_CATALOG_REQUIRED",
      "warnings": []
    }
  ],
  "fold_note": "R4/R6→R3 = direction owner souhaitée, PENDING_ADR (étend ADR-027) ; pas canon. R5 déjà replié (ADR-027).",
  "fold_readiness": {
    "R4_to_R3": "BLOCKED_PENDING_ADR",
    "R5_to_R3": "READY_ADR_027",
    "R6_to_R3": "BLOCKED_PENDING_ADR"
  },
  "intent_targets": [
    "diagnostic",
    "achat",
    "compatibilite"
  ],
  "inventory_status": "DIAGNOSTIC_READY",
  "next_action": "PROMOTE_RAW_TO_WIKI",
  "pg_id": 8,
  "provenance": {
    "completeness_profile": "filtration",
    "source_type": "gamme",
    "sources": [
      {
        "content_hash": "sha256:27eab1f7b226f863267e0d121fb02a7dc128063ca3bd5d804a0f7040804fb787",
        "kind": "evidence",
        "path": "recycled/rag-knowledge/_raw/evidence/filtre-a-air.yml"
      },
      {
        "content_hash": "sha256:09e4d5bef4f79c7f45ab1c56b0172a8d8ab4f006b4d766d99eea501a465574d0",
        "kind": "gamme",
        "path": "recycled/rag-knowledge/gammes/filtre-a-air.md"
      },
      {
        "content_hash": "sha256:5db34aaf345a4c97b5cc4329a8453309d2351609edcacc81ac0fe546f2595a3b",
        "kind": "guide",
        "path": "recycled/rag-knowledge/guides/choisir-filtre-air.md"
      }
    ],
    "truth_level": "L3",
    "unlinked_source_types": [],
    "verification_status": "verified"
  },
  "raw_verdict": "READY",
  "schema_version": "raw-evidence.v1",
  "subject": "filtre-a-air"
}
