{
  "coverage": [
    {
      "block": "A.domain",
      "canon_role": "R4",
      "fold_status": "PENDING_ADR",
      "r3_section": "reference",
      "status": "PRESENT",
      "warnings": []
    },
    {
      "block": "B.selection",
      "canon_role": "R6",
      "fold_status": "PENDING_ADR",
      "r3_section": "guide-achat",
      "status": "PARTIAL",
      "warnings": [
        "selection.cost_range suspect (25-350)"
      ]
    },
    {
      "block": "C.diagnostic",
      "canon_role": "R5",
      "fold_status": "LIVE",
      "r3_section": "diagnostic-rapide",
      "status": "PRESENT",
      "warnings": []
    },
    {
      "block": "D.maintenance",
      "canon_role": "R3",
      "fold_status": "NATIVE",
      "r3_section": "maintenance",
      "status": "PRESENT",
      "warnings": [
        "maintenance.usage_factors required when unit != km"
      ]
    },
    {
      "block": "E.installation",
      "canon_role": "R3",
      "fold_status": "NATIVE",
      "r3_section": "installation",
      "status": "PRESENT",
      "warnings": [
        "installation.steps < 3 (0)"
      ]
    },
    {
      "block": "5.0:variants",
      "canon_role": "—",
      "fold_status": "NOT_FOLDED",
      "r3_section": null,
      "status": "NOT_MAPPED",
      "warnings": []
    },
    {
      "block": "5.0:location_on_vehicle",
      "canon_role": "—",
      "fold_status": "NOT_FOLDED",
      "r3_section": null,
      "status": "NOT_MAPPED",
      "warnings": []
    },
    {
      "block": "5.0:purchase_guardrails",
      "canon_role": "—",
      "fold_status": "NOT_FOLDED",
      "r3_section": null,
      "status": "NOT_MAPPED",
      "warnings": []
    },
    {
      "block": "5.0:conseil_v5",
      "canon_role": "—",
      "fold_status": "NOT_FOLDED",
      "r3_section": null,
      "status": "NOT_MAPPED",
      "warnings": []
    },
    {
      "block": "5.0:diagnostic.depose_steps",
      "canon_role": "—",
      "fold_status": "NOT_FOLDED",
      "r3_section": null,
      "status": "NOT_MAPPED",
      "warnings": []
    },
    {
      "block": "compatibility",
      "canon_role": "R1/R2",
      "fold_status": "NOT_FOLDED",
      "r3_section": null,
      "status": "BLOCKED_CATALOG_REQUIRED",
      "warnings": []
    }
  ],
  "fold_note": "R4/R6→R3 = direction owner souhaitée, PENDING_ADR (étend ADR-027) ; pas canon. R5 déjà replié (ADR-027).",
  "fold_readiness": {
    "R4_to_R3": "BLOCKED_PENDING_ADR",
    "R5_to_R3": "READY_ADR_027",
    "R6_to_R3": "BLOCKED_PENDING_ADR"
  },
  "intent_targets": [
    "diagnostic",
    "achat",
    "compatibilite"
  ],
  "inventory_status": "DIAGNOSTIC_READY",
  "next_action": "ENRICH_RAW_B",
  "pg_id": 469,
  "provenance": {
    "completeness_profile": null,
    "source_type": "gamme",
    "sources": [
      {
        "content_hash": "sha256:547ba840fe6d440378b033b3649a2184e949f5eefed76447371addb49ada4f1b",
        "kind": "gamme",
        "path": "recycled/rag-knowledge/gammes/radiateur-d-huile.md"
      }
    ],
    "truth_level": "L2",
    "unlinked_source_types": [
      "guide"
    ],
    "verification_status": "draft"
  },
  "raw_verdict": "PARTIAL_READY",
  "schema_version": "raw-evidence.v1",
  "subject": "radiateur-d-huile"
}
