{
  "coverage": [
    {
      "block": "A.domain",
      "canon_role": "R4",
      "fold_status": "PENDING_ADR",
      "r3_section": "reference",
      "status": "PRESENT",
      "warnings": []
    },
    {
      "block": "B.selection",
      "canon_role": "R6",
      "fold_status": "PENDING_ADR",
      "r3_section": "guide-achat",
      "status": "PRESENT",
      "warnings": []
    },
    {
      "block": "C.diagnostic",
      "canon_role": "R5",
      "fold_status": "LIVE",
      "r3_section": "diagnostic-rapide",
      "status": "PRESENT",
      "warnings": []
    },
    {
      "block": "D.maintenance",
      "canon_role": "R3",
      "fold_status": "NATIVE",
      "r3_section": "maintenance",
      "status": "PRESENT",
      "warnings": []
    },
    {
      "block": "E.installation",
      "canon_role": "R3",
      "fold_status": "NATIVE",
      "r3_section": "installation",
      "status": "PRESENT",
      "warnings": []
    },
    {
      "block": "5.0:variants",
      "canon_role": "—",
      "fold_status": "NOT_FOLDED",
      "r3_section": null,
      "status": "NOT_MAPPED",
      "warnings": []
    },
    {
      "block": "5.0:location_on_vehicle",
      "canon_role": "—",
      "fold_status": "NOT_FOLDED",
      "r3_section": null,
      "status": "NOT_MAPPED",
      "warnings": []
    },
    {
      "block": "5.0:conseil_v5",
      "canon_role": "—",
      "fold_status": "NOT_FOLDED",
      "r3_section": null,
      "status": "NOT_MAPPED",
      "warnings": []
    },
    {
      "block": "5.0:diagnostic.depose_steps",
      "canon_role": "—",
      "fold_status": "NOT_FOLDED",
      "r3_section": null,
      "status": "NOT_MAPPED",
      "warnings": []
    },
    {
      "block": "compatibility",
      "canon_role": "R1/R2",
      "fold_status": "NOT_FOLDED",
      "r3_section": null,
      "status": "BLOCKED_CATALOG_REQUIRED",
      "warnings": []
    }
  ],
  "fold_note": "R4/R6→R3 = direction owner souhaitée, PENDING_ADR (étend ADR-027) ; pas canon. R5 déjà replié (ADR-027).",
  "fold_readiness": {
    "R4_to_R3": "BLOCKED_PENDING_ADR",
    "R5_to_R3": "READY_ADR_027",
    "R6_to_R3": "BLOCKED_PENDING_ADR"
  },
  "intent_targets": [
    "diagnostic",
    "achat",
    "reference",
    "entretien"
  ],
  "inventory_status": "DIAGNOSTIC_READY",
  "next_action": "PROMOTE_RAW_TO_WIKI",
  "pg_id": 82,
  "provenance": {
    "completeness_profile": null,
    "source_type": "gamme",
    "sources": [
      {
        "content_hash": "sha256:76a08ef816be854960a6fb27a2ad82bddc7f945473bc1bc650dce387545b1a5f",
        "kind": "evidence",
        "path": "recycled/rag-knowledge/_raw/evidence/disque-de-frein.yml"
      },
      {
        "content_hash": "sha256:9796fe063018f9b23c5e9ac47598ae3e73ba011b6f82f5d081ba138d0fdc4494",
        "kind": "gamme",
        "path": "recycled/rag-knowledge/gammes/disque-de-frein.md"
      }
    ],
    "truth_level": "L2",
    "unlinked_source_types": [
      "guide"
    ],
    "verification_status": "draft"
  },
  "raw_verdict": "READY",
  "schema_version": "raw-evidence.v1",
  "subject": "disque-de-frein"
}
